{
	"$schema": "./schema.json",
	"external_references": [
		{
			"description": "Original design conversation that produced the SysProM model.",
			"identifier": "https://chatgpt.com/c/69bd2439-ad5c-838d-9af1-2e1294a0d331",
			"node_id": "I1",
			"role": "source"
		},
		{
			"description": "Spec Kit's workflow limitations motivated the addition of process modelling.",
			"identifier": "https://github.com/github/spec-kit",
			"node_id": "D4",
			"role": "prior_art"
		},
		{
			"description": "Ralplan's consensus planning protocol demonstrated the need for roles, stages, and gates as first-class nodes.",
			"identifier": "https://github.com/yeachan-heo/oh-my-claudecode/blob/main/skills/ralplan/SKILL.md",
			"node_id": "D4",
			"role": "prior_art"
		},
		{
			"description": "GSD's multi-runtime orchestration demonstrated the need for modes and runtime-adaptive realisations.",
			"identifier": "https://github.com/gsd-build/get-shit-done",
			"node_id": "D4",
			"role": "prior_art"
		},
		{
			"description": "RFC 2119 defines the interpretation of MUST, SHOULD, and MAY used throughout the specification.",
			"identifier": "https://datatracker.ietf.org/doc/html/rfc2119",
			"node_id": "CN8",
			"role": "standard"
		}
	],
	"metadata": {
		"doc_type": "sysprom",
		"scope": "system",
		"status": "active",
		"title": "SysProM — System Provenance Model",
		"version": 1
	},
	"nodes": [
		{
			"description": "Enable any system — regardless of domain — to record where every part came from, what decisions shaped it, and how it reached its current form.",
			"id": "INT1",
			"name": "System Provenance",
			"type": "intent"
		},
		{
			"description": [
				"A system is understood through distinct layers of abstraction: intent, concept, capability, structure, and realisation.",
				"Each layer is valid independently of the layers below it."
			],
			"id": "CON1",
			"name": "Layered Abstraction",
			"type": "concept"
		},
		{
			"description": [
				"Systems evolve through explicit decisions.",
				"Decisions select between alternatives, affect nodes, and must preserve invariants.",
				"Decisions are never deleted — they are superseded."
			],
			"id": "CON2",
			"name": "Decision-Driven Evolution",
			"type": "concept"
		},
		{
			"description": [
				"The history of a system is additive. Nodes are deprecated or retired, not erased.",
				"Changes record what happened; they do not overwrite prior state."
			],
			"id": "CON3",
			"name": "Append-Only History",
			"type": "concept"
		},
		{
			"description": [
				"Any node may be treated as a subsystem with its own internal structure.",
				"The same model applies at every level of nesting."
			],
			"id": "CON4",
			"name": "Recursive Composition",
			"type": "concept"
		},
		{
			"description": [
				"Workflows, roles, stages, gates, and artefacts are modelled with the same rigour as domain concepts.",
				"Process is not a second-class concern."
			],
			"id": "CON5",
			"name": "Process as Structure",
			"type": "concept"
		},
		{
			"description": [
				"The model defines semantics, not storage.",
				"It may be represented in Markdown, JSON, a database, or any other structured format."
			],
			"id": "CON6",
			"name": "Format Agnosticism",
			"type": "concept"
		},
		{
			"description": [
				"Nodes may relate to resources outside the graph.",
				"Content may be internalised for portability or referenced for traceability, or both."
			],
			"id": "CON7",
			"name": "External Resource Handling",
			"type": "concept"
		},
		{
			"description": "A system conforms to SysProM if it meets a defined set of minimum requirements, ensuring interoperability and consistency.",
			"id": "CON8",
			"name": "Conformance",
			"type": "concept"
		},
		{
			"description": "A recommended modelling profile for product repositories that uses SysProM to describe the system's specification, design, and implementation with a consistent trace chain across layers.",
			"id": "CON9",
			"name": "System Provenance Profile",
			"type": "concept"
		},
		{
			"description": "Trace any node from intent through concept, capability, and structure to realisation.",
			"id": "CAP1",
			"name": "Cross-Layer Traceability",
			"type": "capability"
		},
		{
			"description": "Record choices with alternatives considered, rationale, affected nodes, and preserved invariants.",
			"id": "CAP2",
			"name": "Decision Recording",
			"type": "capability"
		},
		{
			"description": [
				"Define rules that must hold across all valid system states.",
				"Decisions and changes must explicitly identify which invariants they preserve."
			],
			"id": "CAP3",
			"name": "Invariant Enforcement",
			"type": "capability"
		},
		{
			"description": "Record every addition, modification, removal, and transition with scope, decision, and lifecycle state.",
			"id": "CAP4",
			"name": "Change Tracking",
			"type": "capability"
		},
		{
			"description": "Represent any node as a subsystem with its own nodes, relationships, decisions, and changes, using the same conventions at every depth.",
			"id": "CAP5",
			"name": "Recursive Modelling",
			"type": "capability"
		},
		{
			"description": "Define protocols, stages, roles, gates, modes, artefacts, and artefact flows as first-class graph nodes.",
			"id": "CAP6",
			"name": "Process Modelling",
			"type": "capability"
		},
		{
			"description": "Encode the model in a single file, a multi-document folder, nested folders, or a non-file format, with the same underlying semantics.",
			"id": "CAP7",
			"name": "Flexible Representation",
			"type": "capability"
		},
		{
			"description": "Reference or internalise resources outside the graph with typed roles (input, output, context, evidence, source, standard, prior_art).",
			"id": "CAP8",
			"name": "External Resource Referencing",
			"type": "capability"
		},
		{
			"description": "The model MUST support multiple concurrent evolution paths (e.g. experimental branches).",
			"id": "CAP9",
			"name": "Branching",
			"type": "capability"
		},
		{
			"description": "Branches MAY be merged.",
			"id": "CAP10",
			"name": "Merging",
			"type": "capability"
		},
		{
			"description": "Previously deprecated or retired nodes MAY be reintroduced.",
			"id": "CAP11",
			"name": "Revival",
			"type": "capability"
		},
		{
			"description": "Guide authors to model product systems through intent, concept, capability, element, realisation, artefact, decision, and change nodes with practical traceability and implementation provenance.",
			"id": "CAP12",
			"name": "Product Repository Modelling Guidance",
			"type": "capability"
		},
		{
			"description": "Concept nodes MUST NOT depend on realisation nodes. The conceptual layer must be valid even if no realisation exists.",
			"id": "INV1",
			"name": "Concept Independence",
			"type": "invariant"
		},
		{
			"description": "Every change MUST reference at least one decision. No change occurs without an explicit choice.",
			"id": "INV2",
			"name": "Decision-Change Linkage",
			"type": "invariant"
		},
		{
			"description": [
				"A decision that affects domain nodes (intent, concept, capability, element, invariant) MUST identify the invariants it preserves via must_preserve relationships.",
				"A decision that affects only non-domain nodes (realisation, policy, protocol, stage, role, gate, mode, artefact) SHOULD identify preserved invariants but is not required to.",
				"Domain nodes define what the system IS. Non-domain nodes define how it works or how it is implemented."
			],
			"id": "INV3",
			"name": "Invariant Preservation",
			"type": "invariant"
		},
		{
			"description": [
				"The same model MUST apply at all levels of recursion.",
				"A subsystem uses the same node types, relationship types, and conventions as the root system."
			],
			"id": "INV4",
			"name": "Recursive Consistency",
			"type": "invariant"
		},
		{
			"description": "Superseded decisions and deprecated nodes MUST remain part of the system. History is never deleted.",
			"id": "INV5",
			"name": "Append-Only History",
			"type": "invariant"
		},
		{
			"description": "Every node MUST have a unique identifier and a defined type. No anonymous entities.",
			"id": "INV6",
			"name": "Node Identity",
			"type": "invariant"
		},
		{
			"description": "Every relationship MUST be directional, typed, and reference valid nodes.",
			"id": "INV7",
			"name": "Relationship Validity",
			"type": "invariant"
		},
		{
			"description": "Every gate MUST reference the invariant or policy it enforces.",
			"id": "INV8",
			"name": "Gate Justification",
			"type": "invariant"
		},
		{
			"description": "Refinement flows downward through abstraction layers. Nodes MUST NOT refine nodes in a lower layer.",
			"id": "INV9",
			"name": "Layer Direction",
			"type": "invariant"
		},
		{
			"description": "Realisation nodes MUST implement element nodes. A realisation without a parent element is invalid.",
			"id": "INV10",
			"name": "Realisation Implements Element",
			"type": "invariant"
		},
		{
			"description": "Stages within a protocol MUST have defined ordering via precedes or must_follow relationships.",
			"id": "INV11",
			"name": "Stage Ordering",
			"type": "invariant"
		},
		{
			"description": "Every decision MUST reference the nodes it affects via an affects relationship.",
			"id": "INV12",
			"name": "Decision Affects Reference",
			"type": "invariant"
		},
		{
			"description": "Every decision MUST define the selected option and list alternatives considered.",
			"id": "INV13",
			"name": "Decision Selection",
			"type": "invariant"
		},
		{
			"description": "Every change MUST define its scope (the nodes it affects).",
			"id": "INV14",
			"name": "Change Scope",
			"type": "invariant"
		},
		{
			"description": "Every change MUST define its operations (add, update, remove, link).",
			"id": "INV15",
			"name": "Change Operations",
			"type": "invariant"
		},
		{